"title","price","stock","category"
"The 10% Entrepreneur: Live Your Startup Dream Without Quitting Your Day Job","£27.55"," In stock "," Business "
"The 14th Colony (Cotton Malone #11)","£39.24"," In stock "," Thriller "
"The Activist's Tao Te Ching: Ancient Advice for a Modern Revolution","£32.24"," In stock "," Spirituality "
"The Age of Genius: The Seventeenth Century and the Birth of the Modern Mind","£19.73"," In stock "," History "
"The Argonauts","£10.93"," In stock "," Autobiography "
"The Art and Science of Low Carbohydrate Living","£52.98"," In stock "," Health "
"The Art Book","£32.34"," In stock "," Art "
"The Art Forger","£40.76"," In stock "," Add a comment "
"The Art of Startup Fundraising","£21.00"," In stock "," Business "
"The Artist's Way: A Spiritual Path to Higher Creativity","£38.49"," In stock "," Nonfiction "
"The Bachelor Girl's Guide to Murder (Herringford and Watts Mysteries #1)","£52.30"," In stock "," Mystery "
"The Bane Chronicles (The Bane Chronicles #1-11)","£44.73"," In stock "," Fantasy "
"The Bear and the Piano","£36.89"," In stock "," Childrens "
"The Bhagavad Gita","£57.49"," In stock "," Religion "
"The Black Maria","£52.15"," In stock "," Poetry "
"The Bone Hunters (Lexy Vaughan & Steven Macaulay #2)","£59.71"," In stock "," Thriller "
"The Book of Basketball: The NBA According to The Sports Guy","£44.84"," In stock "," Sports and Games "
"The Book of Mormon","£24.57"," In stock "," Religion "
"The Boys in the Boat: Nine Americans and Their Epic Quest for Gold at the 1936 Berlin Olympics","£22.60"," In stock "," Default "
"The Bridge to Consciousness: I'm Writing the Bridge Between Science and Our Old and New Beliefs.","£32.00"," In stock "," Default "
"The Bulletproof Diet: Lose up to a Pound a Day, Reclaim Energy and Focus, Upgrade Your Life","£49.05"," In stock "," Health "
"The Collected Poems of W.B. Yeats (The Collected Works of W.B. Yeats #1)","£15.42"," In stock "," Poetry "
"The Coming Woman: A Novel Based on the Life of the Infamous Feminist, Victoria Woodhull","£17.93"," In stock "," Default "
"The Complete Stories and Poems (The Works of Edgar Allan Poe [Cameo Edition])","£26.78"," In stock "," Classics "
"The Constant Princess (The Tudor Court #1)","£16.62"," In stock "," Historical Fiction "
"The Cookies & Cups Cookbook: 125+ sweet & savory recipes reminding you to Always Eat Dessert First","£41.25"," In stock "," Food and Drink "
"The Crossover","£38.77"," In stock "," Poetry "
"The Darkest Lie","£35.35"," In stock "," Young Adult "
"The Day the Crayons Came Home (Crayons)","£26.33"," In stock "," Childrens "
"The Death of Humanity: and the Case for Life","£58.11"," In stock "," Philosophy "
"The Devil Wears Prada (The Devil Wears Prada #1)","£44.29"," In stock "," Womens Fiction "
"The Dirty Little Secrets of Getting Your Dream Job","£33.34"," In stock "," Business "
"The Disappearing Spoon: And Other True Tales of Madness, Love, and the History of the World from the Periodic Table of the Elements","£57.35"," In stock "," Science "
"The Dovekeepers","£48.78"," In stock "," Add a comment "
"The E-Myth Revisited: Why Most Small Businesses Don't Work and What to Do About It","£36.91"," In stock "," Business "
"The Edge of Reason (Bridget Jones #2)","£19.18"," In stock "," Womens Fiction "
"The Electric Pencil: Drawings from Inside State Hospital No. 3","£56.06"," In stock "," Nonfiction "
"The Elegant Universe: Superstrings, Hidden Dimensions, and the Quest for the Ultimate Theory","£13.03"," In stock "," Science "
"The Elephant Tree","£23.82"," In stock "," Thriller "
"The Emerald Mystery","£23.15"," In stock "," Default "
"The Epidemic (The Program 0.6)","£14.44"," In stock "," Young Adult "
"The Fabric of the Cosmos: Space, Time, and the Texture of Reality","£55.91"," In stock "," Science "
"The Faith of Christopher Hitchens: The Restless Soul of the World's Most Notorious Atheist","£39.55"," In stock "," Biography "
"The First Hostage (J.B. Collins #2)","£25.85"," In stock "," Fiction "
"The Five Love Languages: How to Express Heartfelt Commitment to Your Mate","£31.05"," In stock "," Nonfiction "
"The Four Agreements: A Practical Guide to Personal Freedom","£17.66"," In stock "," Spirituality "
"The Genius of Birds","£17.24"," In stock "," Nonfiction "
"The Girl on the Train","£55.02"," In stock "," Default "
"The Girl with All the Gifts","£49.47"," In stock "," Horror "
"The Girl You Left Behind (The Girl You Left Behind #1)","£15.79"," In stock "," Historical "
"The Glittering Court (The Glittering Court #1)","£44.28"," In stock "," Fantasy "
"The Golden Condom: And Other Essays on Love Lost and Found","£39.43"," In stock "," Psychology "
"The Grand Design","£13.76"," In stock "," Science "
"The Great Railway Bazaar","£30.54"," In stock "," Travel "
"The Grownup","£35.88"," In stock "," Short Stories "
"The Guernsey Literary and Potato Peel Pie Society","£49.53"," In stock "," Historical Fiction "
"The Guilty (Will Robie #4)","£13.82"," In stock "," Thriller "
"The Guns of August","£14.54"," In stock "," History "
"The Gutsy Girl: Escapades for Your Life of Epic Adventure","£37.13"," In stock "," Nonfiction "
"The Help Yourself Cookbook for Kids: 60 Easy Plant-Based Recipes Kids Can Make to Stay Healthy and Save the Earth","£28.77"," In stock "," Food and Drink "
"The Hidden Oracle (The Trials of Apollo #1)","£52.26"," In stock "," Fantasy "
"The Hiding Place","£55.91"," In stock "," History "
"The Hook Up (Game On #1)","£36.29"," In stock "," New Adult "
"The Hound of the Baskervilles (Sherlock Holmes #5)","£14.82"," In stock "," Classics "
"The House by the Lake","£36.95"," In stock "," Historical Fiction "
"The Immortal Life of Henrietta Lacks","£40.67"," In stock "," Add a comment "
"The Inefficiency Assassin: Time Management Tactics for Working Smarter, Not Longer","£20.59"," In stock "," Default "
"The Invention of Wings","£37.34"," In stock "," Historical Fiction "
"The Kite Runner","£41.82"," In stock "," Default "
"The Last Girl (The Dominion Trilogy #1)","£36.26"," In stock "," Science Fiction "
"The Last Mile (Amos Decker #2)","£54.21"," In stock "," Mystery "
"The Last Painting of Sara de Vos","£55.55"," In stock "," Historical Fiction "
"The Lean Startup: How Today's Entrepreneurs Use Continuous Innovation to Create Radically Successful Businesses","£33.92"," In stock "," Business "
"The Life-Changing Magic of Tidying Up: The Japanese Art of Decluttering and Organizing","£16.77"," In stock "," Nonfiction "
"The Little Prince","£45.42"," In stock "," Classics "
"The Lonely Ones","£43.59"," In stock "," Childrens "
"The Loney","£23.40"," In stock "," Horror "
"The Long Haul (Diary of a Wimpy Kid #9)","£44.07"," In stock "," Humor "
"The Long Shadow of Small Ghosts: Murder and Memory in an American City","£10.97"," In stock "," Crime "
"The Love and Lemons Cookbook: An Apple-to-Zucchini Celebration of Impromptu Cooking","£37.60"," In stock "," Food and Drink "
"The Lucifer Effect: Understanding How Good People Turn Evil","£10.40"," In stock "," Psychology "
"The Marriage of Opposites","£28.08"," In stock "," Historical Fiction "
"The Matchmaker's Playbook (Wingmen Inc. #1)","£55.85"," In stock "," New Adult "
"The Mathews Men: Seven Brothers and the War Against Hitler's U-boats","£42.91"," In stock "," History "
"The Metamorphosis","£28.58"," In stock "," Classics "
"The Midnight Watch: A Novel of the Titanic and the Californian","£26.20"," In stock "," Add a comment "
"The Mindfulness and Acceptance Workbook for Anxiety: A Guide to Breaking Free from Anxiety, Phobias, and Worry Using Acceptance and Commitment Therapy","£23.89"," In stock "," Add a comment "
"The Mistake (Off-Campus #2)","£43.29"," In stock "," New Adult "
"The Moosewood Cookbook: Recipes from Moosewood Restaurant, Ithaca, New York","£12.34"," In stock "," Food and Drink "
"The Most Perfect Thing: Inside (and Outside) a Bird's Egg","£42.96"," In stock "," Science "
"The Murder of Roger Ackroyd (Hercule Poirot #4)","£44.10"," In stock "," Mystery "
"The Murder That Never Was (Forensic Instincts #5)","£54.11"," In stock "," Fiction "
"The Nameless City (The Nameless City #1)","£38.16"," In stock "," Sequential Art "
"The Nanny Diaries (Nanny #1)","£52.53"," In stock "," Womens Fiction "
"The Natural History of Us (The Fine Art of Pretending #2)","£45.22"," In stock "," Young Adult "
"The Nerdy Nummies Cookbook: Sweet Treats for the Geek in All of Us","£37.34"," In stock "," Food and Drink "
"The New Drawing on the Right Side of the Brain","£43.02"," In stock "," Art "
"The Nicomachean Ethics","£36.34"," In stock "," Philosophy "
"The Omnivore's Dilemma: A Natural History of Four Meals","£38.21"," In stock "," Nonfiction "
"The Origin of Species","£10.01"," In stock "," Science "
"The Passion of Dolssa","£28.32"," In stock "," Historical Fiction "
"The Past Never Ends","£56.50"," In stock "," Mystery "
"The Perfect Play (Play by Play #1)","£59.99"," In stock "," Romance "
"The Picture of Dorian Gray","£29.70"," In stock "," Classics "
"The Pilgrim's Progress","£50.26"," In stock "," Classics "
"The Pioneer Woman Cooks: Dinnertime: Comfort Classics, Freezer Food, 16-Minute Meals, and Other Delicious Ways to Solve Supper!","£56.41"," In stock "," Food and Drink "
"The Power of Now: A Guide to Spiritual Enlightenment","£43.54"," In stock "," Nonfiction "
"The Project","£10.65"," In stock "," Science Fiction "
"The Psychopath Test: A Journey Through the Madness Industry","£36.00"," In stock "," Default "
"The Red Tent","£35.66"," In stock "," Historical Fiction "
"The Regional Office Is Under Attack!","£51.36"," In stock "," Fiction "
"The Requiem Red","£22.65"," In stock "," Young Adult "
"The Restaurant at the End of the Universe (Hitchhiker's Guide to the Galaxy #2)","£10.92"," In stock "," Science Fiction "
"The Rise and Fall of the Third Reich: A History of Nazi Germany","£39.67"," In stock "," History "
"The Rise of Theodore Roosevelt (Theodore Roosevelt #1)","£42.57"," In stock "," Biography "
"The Road to Little Dribbling: Adventures of an American in Britain (Notes From a Small Island #2)","£23.21"," In stock "," Travel "
"The Secret (The Secret #1)","£27.37"," In stock "," Default "
"The Secret Garden","£15.08"," In stock "," Classics "
"The Secret of Dreadwillow Carse","£56.13"," In stock "," Childrens "
"The Selfish Gene","£29.45"," In stock "," Science "
"The Song of Achilles","£37.40"," In stock "," Add a comment "
"The Stand","£57.86"," In stock "," Horror "
"The Star-Touched Queen","£46.02"," In stock "," Fantasy "
"The Star-Touched Queen","£32.30"," In stock "," Fantasy "
"The Story of Art","£41.14"," In stock "," Art "
"The Story of Hong Gildong","£43.19"," In stock "," Classics "
"The Stranger","£17.44"," In stock "," Philosophy "
"The Testament of Mary","£52.67"," In stock "," Fiction "
"The Thing About Jellyfish","£48.77"," In stock "," Childrens "
"The Third Wave: An Entrepreneur’s Vision of the Future","£12.61"," In stock "," Business "
"The Time Keeper","£27.88"," In stock "," Fiction "
"The Torch Is Passed: A Harding Family Story","£19.09"," In stock "," Add a comment "
"The Travelers","£15.77"," In stock "," Thriller "
"The Undomestic Goddess","£45.75"," In stock "," Womens Fiction "
"The Vacationers","£42.15"," In stock "," Fiction "
"The Wedding Dress","£24.12"," In stock "," Romance "
"The Wedding Pact (The O'Malleys #2)","£32.61"," In stock "," Romance "
"The Whale","£35.96"," In stock "," Childrens "
"The White Cat and the Monk: A Retelling of the Poem “Pangur Bán”","£58.08"," In stock "," Childrens "
"The White Queen (The Cousins' War #1)","£25.91"," In stock "," Add a comment "
"The Widow","£27.26"," In stock "," Mystery "
"The Wild Robot","£56.07"," In stock "," Childrens "
"Thinking, Fast and Slow","£21.14"," In stock "," Psychology "
"Thirst","£17.27"," In stock "," Fiction "
"Thirteen Reasons Why","£52.72"," In stock "," Default "
"This Is Where It Ends","£27.12"," In stock "," Young Adult "
"This Is Your Brain on Music: The Science of a Human Obsession","£38.40"," In stock "," Music "
"This One Summer","£19.49"," In stock "," Sequential Art "
"Thomas Jefferson and the Tripoli Pirates: The Forgotten War That Changed American History","£59.64"," In stock "," History "
"Three Wishes (River of Time: California #1)","£44.18"," In stock "," Science Fiction "
"Throne of Glass (Throne of Glass #1)","£35.07"," In stock "," Fantasy "
"Throwing Rocks at the Google Bus: How Growth Became the Enemy of Prosperity","£31.12"," In stock "," Nonfiction "
"Tipping Point for Planet Earth: How Close Are We to the Edge?","£37.55"," In stock "," Science "
"Tipping the Velvet","£53.74"," In stock "," Historical Fiction "
"Toddlers Are A**holes: It's Not Your Fault","£25.55"," In stock "," Humor "
"Tracing Numbers on a Train","£41.60"," In stock "," Default "
"Tsubasa: WoRLD CHRoNiCLE 2 (Tsubasa WoRLD CHRoNiCLE #2)","£16.28"," In stock "," Sequential Art "
"Tuesday Nights in 1980","£21.04"," In stock "," Fiction "
"Twenties Girl","£42.80"," In stock "," Womens Fiction "
"Twenty Love Poems and a Song of Despair","£30.95"," In stock "," Poetry "
"Twenty Yawns","£22.08"," In stock "," Childrens "
"Unbound: How Eight Technologies Made Us Human, Transformed Society, and Brought Our World to the Brink","£25.52"," In stock "," History "
"Under the Tuscan Sun","£37.33"," In stock "," Travel "
"Unicorn Tracks","£18.78"," In stock "," Fantasy "
"Unreasonable Hope: Finding Faith in the God Who Brings Purpose to Your Pain","£46.33"," In stock "," Spirituality "
"Unseen City: The Majesty of Pigeons, the Discreet Charm of Snails & Other Wonders of the Urban Wilderness","£44.18"," In stock "," Nonfiction "
"Until Friday Night (The Field Party #1)","£46.31"," In stock "," Young Adult "
"Untitled Collection: Sabbath Poems 2014","£14.27"," In stock "," Poetry "
"Vagabonding: An Uncommon Guide to the Art of Long-Term World Travel","£36.94"," In stock "," Travel "
"Vampire Knight, Vol. 1 (Vampire Knight #1)","£15.40"," In stock "," Paranormal "
"Voyager (Outlander #3)","£21.07"," In stock "," Historical Fiction "
"Wall and Piece","£44.18"," In stock "," Art "
"Walt Disney's Alice in Wonderland","£12.96"," In stock "," Childrens "
"Ways of Seeing","£39.51"," In stock "," Art "
"We Are All Completely Beside Ourselves","£24.04"," In stock "," Contemporary "
"We Love You, Charlie Freeman","£50.27"," In stock "," Fiction "
"What Happened on Beale Street (Secrets of the South Mysteries #2)","£25.37"," In stock "," Mystery "
"When We Collided","£31.77"," In stock "," Contemporary "
"When You Are Engulfed in Flames","£30.89"," In stock "," Humor "
"Why the Right Went Wrong: Conservatism--From Goldwater to the Tea Party and Beyond","£52.65"," In stock "," Politics "
"Wild Swans","£14.36"," In stock "," Young Adult "
"Will You Won't You Want Me?","£13.86"," In stock "," Womens Fiction "
"William Shakespeare's Star Wars: Verily, A New Hope (William Shakespeare's Star Wars #4)","£43.30"," In stock "," Science Fiction "
"Without Borders (Wanderlove #1)","£45.07"," In stock "," New Adult "
"World Without End (The Pillars of the Earth #2)","£32.97"," In stock "," Historical Fiction "
"Worlds Elsewhere: Journeys Around Shakespeare’s Globe","£40.30"," In stock "," Nonfiction "
"Wuthering Heights","£17.73"," In stock "," Classics "
"You (You #1)","£43.61"," In stock "," Thriller "
"You Are a Badass: How to Stop Doubting Your Greatness and Start Living an Awesome Life","£12.08"," In stock "," Self Help "
"You Are What You Love: The Spiritual Power of Habit","£21.87"," In stock "," Religion "
"You can't bury them all: Poems","£33.63"," In stock "," Poetry "
"Zealot: The Life and Times of Jesus of Nazareth","£24.70"," In stock "," History "